{"$schema":"https://json-schema.org/draft/2020-12/schema","$id":"https://agensfield.dev/scriba/schemas/codex-profile.schema.json","title":"Scriba Codex profile output","type":"object","additionalProperties":false,"required":["schemaVersion","providerId","source","profile","stats","metadata","authState"],"properties":{"schemaVersion":{"const":"scriba.v1"},"providerId":{"const":"codex"},"source":{"type":"string","minLength":1},"profile":{"type":"object","additionalProperties":false,"properties":{"username":{"type":"string"},"displayName":{"type":"string"},"profilePictureUrl":{"type":"string"}}},"stats":{"$ref":"#/$defs/stats"},"metadata":{"type":"object","additionalProperties":false,"properties":{"statsAsOf":{"type":"string"},"generatedAt":{"type":"string","format":"date-time"},"statsError":{}}},"provenance":{"type":"array","items":{"$ref":"status.schema.json#/$defs/provenance"}},"authState":{"$ref":"codex-limits.schema.json#/$defs/authState"}},"$defs":{"bucket":{"type":"object","additionalProperties":false,"required":["startDate","tokens"],"properties":{"startDate":{"type":"string"},"tokens":{"type":"integer","minimum":0}}},"invocation":{"type":"object","additionalProperties":false,"properties":{"type":{"type":"string"},"pluginId":{"type":"string"},"pluginName":{"type":"string"},"skillId":{"type":"string"},"skillName":{"type":"string"},"usageCount":{"type":"integer","minimum":0}}},"stats":{"type":"object","additionalProperties":false,"properties":{"lifetimeTokens":{"type":"integer","minimum":0},"peakDailyTokens":{"type":"integer","minimum":0},"currentStreakDays":{"type":"integer","minimum":0},"longestStreakDays":{"type":"integer","minimum":0},"longestRunningTurnSec":{"type":"integer","minimum":0},"fastModeUsagePercentage":{"type":"number","minimum":0,"maximum":100},"mostUsedReasoningEffort":{"type":"string"},"mostUsedReasoningEffortPercentage":{"type":"number","minimum":0,"maximum":100},"totalThreads":{"type":"integer","minimum":0},"totalSkillsUsed":{"type":"integer","minimum":0},"uniqueSkillsUsed":{"type":"integer","minimum":0},"workspaceRank":{"type":"integer","minimum":0},"workspaceTotalUserCount":{"type":"integer","minimum":0},"topInvocations":{"type":"array","items":{"$ref":"#/$defs/invocation"}},"dailyUsageBuckets":{"type":"array","items":{"$ref":"#/$defs/bucket"}},"weeklyUsageBuckets":{"type":"array","items":{"$ref":"#/$defs/bucket"}},"cumulativeDailyUsageBuckets":{"type":"array","items":{"$ref":"#/$defs/bucket"}}}}}}
