{"authState":{"ok":true,"source":"codex-auth"},"metadata":{"generatedAt":"2026-07-12T09:00:00Z","statsAsOf":"2026-07-11"},"profile":{"displayName":"Arda Sevinc","username":"ardasevinc"},"provenance":[{"fetchedAt":"2026-07-12T09:00:00Z","kind":"provider-api","providerId":"codex"}],"providerId":"codex","schemaVersion":"scriba.v1","source":"chatgpt-codex-profile-backend","stats":{"currentStreakDays":12,"dailyUsageBuckets":[{"startDate":"2026-07-11","tokens":12345}],"lifetimeTokens":8300000000,"topInvocations":[{"skillName":"review","type":"skill","usageCount":4}]}}
